Product Name,Product Rating,Product Price,Product ID
EFAN Womens Oversized Hoodies Sweatshirts Fleece Hooded Pullover Tops Sweaters Casual Comfy Fall Fashion Outfits Clothes 2023,4.4,25.98,B0BGPVXC2L
AUTOMET Half Zip Sweatshirts Cropped Hoodies Fleece Womens Quarter Zip Up Pullover Sweaters Fall Outfits 2023 Winter Clothes,4.3,35.39,B0C7DJ847L
Trendy Queen Womens Oversized Crewneck Sweatshirts Hoodies Fall Outfits Fashion Teen Girls Y2k Winter Clothes,4.5,32.99,B0C6GPLNPC
ANRABESS Oversized Sweatshirt for Women Fleece Long Sleeve Crewneck Casual Pullover Top Fall 2023 Trendy Clothes,4.5,32.99,B0C332W6NB
Trendy Queen Womens Oversized Hoodies Fleece Sweatshirts Long Sleeve Sweaters Pullover Fall Clothes with Pocket,4.6,29.69,B0C65WCS8R
"JUST MY SIZE Women's Plus Size Full, Lightweight Zip-up Hoodie",4.1,12.0,B016LJ6FUM
AUTOMET Womens Sweatshirts Half Zip Cropped Pullover Fleece Quarter Zipper Hoodies Fall outfits Clothes Thumb Hole,4.6,34.99,B0C7KBZXL6
ANRABESS Women's Long Sleeve Sweatshirt Casual Crewneck Loose Fit Pullover Hoodie Fleece Fall Tops,4.4,31.99,B0C2TQGRY6
Trendy Queen Womens Oversized Sweatshirts Hoodies Half Zip Pullover Fall Fashion Outfits 2023 Y2k Clothes,4.4,34.99,B0B5H33HTJ
EFAN Womens Oversized Sweatshirts Hoodies Fleece Crew Neck Pullover Sweaters Casual Comfy Fall Fashion Outfits Clothes 2023,4.5,25.98,B0B98R2LCW
Hanes Women's Full Zip Slub Cotton Jersey Hoodie,4.3,14.95,B016YKIF60
EFAN Womens Oversized Sweatshirts Pullover Hoodies Fleece Sweaters Long Sleeve With Pockets Winter Fall Outfits Y2k Clothes,4.7,32.99,B0C7BHZCZG
AlvaQ Women Casual Button V Neck Hoodies Oversized Pullover Sweatshirt Hooded Tops with Pockets,4.3,36.99,B0B9RZXS5Y
Dokotoo Womens 2023 Hooded Button Collar Drawstring Hoodies Pullover Sweatshirts Casual Long Sleeve Tops Shirts,4.4,35.99,B09CTCCK4J
Dokotoo Women's Casual Crew Neck Sweatshirt Loose Soft Long Sleeve Pullover Tops,4.1,25.99,B0B4JTS1ZP
EFAN Women's Cute Hoodies Teen Girl Fall Jacket Oversized Sweatshirts Casual Drawstring Zip Up Y2K Hoodie with Pocket,4.4,29.99,B09D2YTC3V
Trendy Queen Womens Zip Up Hoodies Long Sleeve Sweatshirts Fall Outfits Oversized Sweaters Casual Fashion Jackets,4.4,32.99,B09DPGCRFT
Trendy Queen Womens Half Zip Pullover Sweatshirts Quarter Zip Oversized Hoodies Sweaters Fall Outfits 2023 Y2K Winter Clothes,4.5,35.59,B0BM4YL9T4
Lauweion Women Solid Basic Fleece Letter Loose Hoodie Sweatshirt Long Sleeve Kangaroo Pocket Drop Shoulder Pullovers Top,4.4,34.99,B09PH616BG
Trendy Queen Womens Zip Up Hoodies Cropped Sweatshirts Fall Outfits Casual Hooded Pullover Sweaters Tops Winter Clothes 2023,4.5,36.99,B0CB834D73
BTFBM Women Fashion Quilted Pattern Lightweight Zipper Long Sleeve Plain Casual Ladies Sweatshirts Pullovers Shirts Tops,4.3,25.99,B07WT32153
SHEWIN Sweatshirts for Women Crewneck Fall Lightweight Solid Color 2023 Fashion Warm Oversized Fit Pullover Sweatshirts,4.0,28.99,B0CBP29G8L
TICTICMIMI Women's Casual Long Sleeve Color Block/Solid Tops Crewneck Sweatshirts Cute Loose Fit Pullovers With Pockets,4.1,28.99,B09TDRR2FS
Saloogoe Sweatshirts for Women Crewneck Cable Knit Sleeve Sweaters Lightweight Fashion 2023,4.6,24.99,B0CB4JZGRJ
SENSERISE Womens Casual Crewneck Sweatshirt Long Sleeve Solid Color Shirt Soft Lightweight Loose Top,4.0,30.99,B08L3F7ZMS
ANRABESS Women's Oversized Sweatshirt Crew Neck Long Sleeve Casual Slit Sloucthy Pullover Top Fall Clothes,4.3,18.99,B0C4F3H885
Womens Tops Ladies Tunics Casual Shirts Long Sleeve Hoodie Pullover Blouses Loose Fitting Tees Fashion Clothing Sweatshirts,4.5,33.99,B09C85DN39
LASLULU Womens Hoodies Fleece Lined Collar Pullover 1/2 Zipper Sweatshirts Long Sleeve Crop Tops Sweater Thumb Hole,4.6,29.98,B09J88G3JJ
Dokotoo Women's Full Zip Up Hoodie Long Sleeve Hooded Sweatshirts Pockets Jacket Coat for Women,4.2,35.99,B08CKVG6XH
Dokotoo Womens Oversized Waffle Knit Crewneck Sweatshirts Long Sleeve Side Slits Casual Pullover Sweatshirt Tops,4.1,28.99,B0CH6LDTV5
DOUBLJU Lightweight Thin Zip-Up Hoodie Jacket for Women with Plus Size,4.4,30.99,B071FFZ2KV
Dofaoo Sweatshirts for Women Crewneck Long Sleeve Shirts Tunic Tops for Leggings,4.4,29.98,B099N1FD7Y
Blooming Jelly Women's Crewneck Sweatshirt Skull Graphic T Shirts Long Sleeve Top Pullover Oversized Sweaters,4.6,35.99,B08GK7HCBN
Jielayou Women's Camo Hoodie Maple-Leaf Print Oversized Sweatshirt Fleece Hooded Sweatshirts with Pocket Casual Fall Pullover,4.3,34.99,B0CHJKNHRJ
Trendy Queen Womens Oversized Sweatshirts Turtleneck Pullover Long Sleeve Hoodies Tops Fall Outfits 2023 Clothes,4.3,29.99,B0C5RC8MGR
AUTOMET Womens Zip Up Cropped Hoodies Fleece Oversized Sweatshirts Full Zipper Jackets Y2k Fall Clothes 2023 Fashion Outfits,4.5,24.97,B0C7KD1D2Q
SHEWIN Women's Casual Hoodies Long Sleeve Solid Lightweight Pullover Tops Loose Sweatshirt with Pocket,4.3,28.99,B098QXRBF1
Bingerlily Womens Casual Long Sleeve Sweatshirt Crew Neck Cute Pullover Relaxed Fit Tops,4.2,36.98,B08DHJ8N6Y
GIVON Basic Lightweight Zip-Up Hoodie Long Sleeve Thin Jacket for Women with Plus Size,4.5,32.99,B07JG1N6CP
PRETTYGARDEN Women's Casual Long Sleeve Zipper Sweatshirt Drawstring Loose Quarter Zip Pullover Tops with Pockets,4.2,28.98,B08KZDJQYZ
AUTOMET Womens Zip Up Hoodies Long Sleeve Fall Oversized Sweatshirts Fleece Y2K Jacket with Pockets,4.5,26.99,B0C7KJHPGK
Floral Find Women's Long Sleeve Lapel Half Zip Up Sweatshirt Solid Stylish Loose Fit Casual Pullover Tops,4.2,25.99,B0B8NKVK99
ANRABESS Women's Sweatshirts Long Sleeve Tunic Tops Crew Neck Soft Pullover With Side Zipper Shirt Clothes 2023,4.4,31.99,B0C4PKJZ4P
LHBNK Halloween Squad Sweatshirt Womens Hocus Pocus Long Sleeve Shirts Sanderson Sisters Pullover Tops Blouse,4.2,23.99,B09DPMX1NZ
ANRABESS Women's Oversized Zip Up Hoodies Sweatshirts Y2K Clothes Teen Girl Fall Casual Drawstring Jackets with Pockets,4.5,31.98,B0C3VG6KLJ
Amazhiyu Women Cropped Sweatshirt Long Sleeves Pullover Fleece Crop Tops,4.1,21.99,B07KT5MX3N
Dokotoo Women's V Neck Button Down Long Sleeve Crop Hoodies Loose Pullover Hooded Sweatshirts Tops,4.2,22.95,B0CCV6FVRF
WEESO Puff Sleeve Tops for Women Fashion Crewneck Sweatshirts,4.2,28.4,B0B1J22QWX
Sofra Women's Thin Cotton Zip Up Hoodie Jacket,4.3,35.99,B01G4GEOK0
Amazon Essentials Women's French Terry Fleece Pullover Hoodie (Available in Plus Size),4.4,39.99,B08698H2YB
Trendy Queen Womens Zip Up Hoodies Fleece Jackets Sweatshirts Fall Outfits Sweaters With Pockets Winter Y2k Clothes,4.3,34.99,B0C8T3M3T7
Caracilia Women Hoodies Oversized Sweatshirts Fleece Sweaters Long Sleeve Shirts Cute Loose Y2K Clothes Fall Pullover Top,4.8,33.99,B0CGK1399M
PRETTYGARDEN Women's Causal 1/4 Zip Pullover Long Sleeve Collar Sweatshirts Solid Activewear Running Jacket,4.1,29.99,B0CC9BWPK9
MAGICMK Women’s Off The Shoulder Pullover Sweatshirts Long Sleeve Lips Print Casual Tops,4.4,25.99,B09FDKQN1Y
BLENCOT Women Half Zip Oversized Sweatshirts Long Sleeve Solid Color Drop Shoulder Fleece Workout Pullover S-2XL,4.4,23.99,B07VRBB6BF
WYNNQUE Womens Quarter Zip Pullover Cropped Hoodies Long Sleeve Fleece Half Zip Sweatshirts Fall Outfits Clothes,4.7,29.99,B0B5TX66KG
AUTOMET Womens Oversized Half Zip Pullover Long Sleeve Sweatshirt Quarter Zip Hoodie Sweater Teen Girls Fall Y2K Clothes,4.3,34.99,B0CFY8XS8K
ANRABESS Women Hoodies Fleece Oversized Sweatshirt Casual Basic Long Sleeve Athletic Workout Pullover Fall Clothes,4.3,29.99,B0C7KDXJ9R
Trendy Queen Oversized Sweatshirts for Women Fleece Hoodies Crewneck Pullover Comfy Sweaters Clothes Fall Winter Fashion 2023,4.4,23.99,B0C45PWG94
PGANDS Womens Crew Neck Color Block/Solid Sweatshirts Tops Long Sleeve Casual Pullover Cute Lightweight Loose Tops,4.3,32.99,B0BKK6ZLQL
OFEEFAN Womens Sweatshirt Crewneck Long Sleeve Shirts for Women High Low Tops Curved Hem,4.4,26.99,B09K7D6SRJ
Amazon Essentials Women's French Terry Fleece Sleeve Detail Crewneck Sweatshirt,4.2,23.7,B0B3M98SMC
Womens Casual Sweatshirts Long Sleeve Shirts Oversized With Pocket Tunic Tops S-2XL,4.2,21.69,B08XQY79K1
KIRUNDO Womens Fall Fashion 2023 Half Zip Oversized Sweatshirts Casual Long Sleeve Fleece Pullover Winter Tops Y2K Clothes,4.6,32.99,B0B6PFS8YQ
ZESICA Women's 2023 Oversized Half Zip Sweatshirt Long Sleeve Quarter Zip Pullover Y2K Hoodies Tops Fall Winter Outfits,4.7,40.99,B0CF5H1QHQ
Amazon Essentials Women's French Terry Hooded Tunic Sweatshirt,4.4,23.7,B0CD4B4S1S
Amazon Essentials Women's French Terry Fleece Full-Zip Hoodie (Available in Plus Size),4.4,26.6,B08XQWLJYT
Ugerlov Womens Oversized Sweatshirt Dress Long Sleeve Crewneck Pullover Tops Relaxed Fit Sweatshirts Mini Dress,3.7,29.74,B07BJ8NLF7
BeadChica Womens Casual Crewneck Sweatshirt Long Sleeve Tops Cute Pullover Loose Fit,4.2,25.99,B0CCXP737C
Syellowafter Women Casual Hoodie Long Sleeves Fashion Pullover Sweatshirts Loose Fit Tunic Winter Tops Comy Shirts,4.3,36.99,B0B97K7KKG
Aokosor Sweatshirts for Women Crewneck Puff Long Sleeve Shirts Loose Casual Tunic Tops,4.6,24.99,B09G2ZPCCM
WEESO Women's Long Sleeve Sweatshirts Color Block Crewneck Sweaters Tunic Tops,4.2,12.78,B0C9DHBF4L
"Hanes Women's Sweatshirt, French Terry Full-Zip Hoodie, Women's Hooded Jacket, Women's Zip Hoodie",4.4,29.99,B098JMTYLH
Trendy Queen Half Zip Sweatshirts Oversized Cropped Hoodies for Womens Long Sleeve Pullover for women,4.4,54.99,B01I94LOUS
Carhartt Women's Relaxed Fit Midweight Logo Sleeve Graphic Sweatshirt,4.8,36.99,B0CFFJ19XK
EFAN Womens Oversized Full Zip Up Sweatshirts Fall Jackets Outfits for Women Fashion 2023 Winter Trendy Cothes with Pocket,4.6,19.99,B07CCXW25P
lymanchi Women Slouchy Shirts Halloween Pumpkin Long Sleeve Sweatshirts Pullover,4.4,30.88,B0C9T87FBD
MISSKY Women Stripe Pocket Knee Length Slim Casual Pullover Hoodie Dress,4.4,26.99,B074N33ZVS
Dokotoo Women's Casual Long Sleeve Hoodies Sweatshirts Drawstring Pullover Tunic Tops With Pockets,4.4,32.99,B01N7JTM53
AUTOMET Womens Oversized Sweatshirts Fleece Hoodies Long Sleeve Shirts Pullover Fall Clothes with Pocket,4.9,29.59,B09B3ZRGCT
Womens Hooded Pullover Sweatshirts Half Zipper Crop Hoodie Fleece Lined Collar Zip Up Hoodies Cropped Long Sleeve Tops,4.6,19.99,B0CBTT4XQS
EVALESS Womens Casual Polka Dots Tops Crewneck Long Sleeve Shirts Fall 2023 Lightweight Loose Sweatshirts,4.3,32.78,B0B9N6J9TZ
ELESOL Women Casual Zip up Fleece Hoodies Tunic Sweatshirt Long Hoodie Jacket S-XXXL,4.4,22.09,B0CBQHLQHK
Trendy Queen Womens Quarter Zip Pullover Oversized Sweatshirts Pockets Half Zip Hoodies Crewneck Fall Clothes Teen Girls,4.3,25.99,B07X1JZ6LN
Saloogoe Sweatshirt for women Side Split Fall Fashion 2023 Long Sleeve Shirts Trending Now,4.7,33.99,B0CBCBHSKH
MISSACTIVER Women Oversized Sweatshirt Dress Patchwork Crewneck Long Sleeve Pullover Tops Flowy Pleated Sweatshirt Mini Dress,3.8,29.99,B0CB6G7KFY
Langwyqu Womens' Oversized Crewneck Long Sleeve Casual Loose Pullover Tops,4.4,28.8,B0CDLWJ799
EVALESS Sweatshirt for Women Casual Solid Color Crewneck Long Sleeve Side Split Tunic Tops Loose Fit Pullover,3.9,24.64,B08LNMHMTJ
BETTE BOUTIK Women's Drop Long Sleeve Sweatshirt Tops Casual Crewneck Tunic Sweartshirts With Side Slits S-3XL,4.1,26.36,B0B5PDMJ97
BLENCOT Women's Lightweight Color Block Hooded Sweaters Drawstring Hoodies Pullover Sweatshirts,4.3,31.99,B09FP6XHM9
Angerella Hoodies for Women Camo Leopard Print Tops Pullover Hooded Sweatshirt Drawstring with Pocket,4.6,21.74,B08GQYRSFK
FAJUYIYO Women's Camo Hoodie Maple-Leaf Print Oversized Sweatshirt Fleece Hooded Sweatshirts with Pocket Classic Pullovers,5.0,34.99,B09MYYVKR5
AUTOMET Women's Half Zip Oversized Sweatshirts Fleece Long Sleeve Hoodies Casual Sweaters with Pockerts,4.6,34.99,B0CHW6SVLY
ANRABESS Womens 2023 Fall Fashion Oversized Quarter Zip Pullover Sweatshirts Hoodie for Teen Girls Trendy Y2K Clothes,4.5,26.99,B0C8T4JD78
morhuduck Women's V Neck Hoodies Long Sleeve Sweatshirt Drawstring Pullover Tops with Pocket,4.1,28.99,B0C6LVB1N5
Bofell Womens Fashion Hoodies for Women Zip Up Sweatshirts Jackets Trending Now 2023,4.4,34.99,B09BVMJP7P
ANRABESS Women Half Zip Cropped Sweatshirt Casual Fleece Quarter Zip Up Rib Knit Pullover 2023 Fall Clothes,4.5,34.99,B0995N4Z3Y
EFAN Womens Oversized Sweatshirts Long Sleeve Crew Neck Pullover Casual Hoodies 2023 Fall Fashion Clothes,4.5,26.99,B0C5J1QVXS
